query	correct_filename
and Testing.Â Highlights Process	70089206.pdf
Intern 05/2016 to 08/2016 Drill	21298336.pdf
Microsoft Certified Professional, Exchange,	18176523.pdf
, State Skills accounts	91121135.pdf
to provide security in client/server	27295996.pdf
great experience. My experience	24322804.pdf
products including system hardware, software,	26480367.pdf
ENGINEERING TUTOR Summary Driven	30288581.pdf
from 324 to more than 2,000. Increased	26801767.pdf
bearings. Gained knowledge in working of	43752620.pdf
information. â€¢Scanned and filed forms, reports, correspondence	20001721.pdf
training and growth and development	31111279.pdf
to Current Self-Sustaining Engineering Technician Company Name	15601399.pdf
instruments used in different	64755882.pdf
University of the District of	28035460.pdf
issues. Worked on connecting and configuring PC's,	25959103.pdf
"Governance in the ERP Post-Implementation Phase"" OAUG"	12488356.pdf
by proving statistics and visual analysis of	55953734.pdf
- Transportation Engineering - Highway Design and	31684925.pdf
Administrator (CCA) Information Systems	16533554.pdf
skills Automation, Workbench Billing, Written Budgets Budget	23497307.pdf
Design, delivery, desktops, XML, help desk support,	13385306.pdf
Belt Instructor Operations management Cross-functional	23666211.pdf
by maintaining current information on HP's internal	52618188.pdf
Promoted within two months of	37242217.pdf
Employed statistics to analyze manufacturing vs. requirements	14049846.pdf
staff.Â Experienced in working in industry and	16899268.pdf
and employee usage of technology. Provides	28672970.pdf
, State , United	20237244.pdf
for both team and	89413122.pdf
equipment on site and in the	23234047.pdf
Predicted Performance of Multilayered Metal-Mesh Screens.	50328713.pdf
systems and supporting software. Support, monitor, test	15802627.pdf
system and performance tests.	13149176.pdf
be Graduation Speaker for	20024870.pdf
specifications for issuing and	23864648.pdf
including backup and recovery. Deploy Symantec endpoint	10553553.pdf
STL, OOP, MFC, threads, file	31677347.pdf
increase efficiency.Consistently received a 100% rate	22450718.pdf
book, CAD, Conversion, Crystal Reports, Customer Service,	56691064.pdf
wheels, apple as boat and pretzel as	18752129.pdf
control loaders and communication systems. Designed	17103000.pdf
Awards Delivering Commencement Address at Montreat College	47919212.pdf
computer System City , State ,	25919149.pdf
organizational, policies, processes, process improvement, Project Management,	35325329.pdf
Chemical Engineering Anticipated graduation date: May	82125182.pdf
of Science : Information Technology	10641230.pdf
team of 8 from Naperville, and	28078163.pdf
XP, Word, Oil, painting, Plumbing, read,	44624796.pdf
